<?xml version="1.0"?>
<xs:schema xmlns:xs="http://www.w3.org/2001/XMLSchema"
           targetNamespace="http://www.w3school.com.cn"
           xmlns="http://www.w3school.com.cn"
           elementFormDefault="qualified">
    <xs:element name="page" >
        <xs:complexType>
            <xs:sequence>
                <xs:element name="ui" type="ui" maxOccurs="unbounded"/>
            </xs:sequence>
            <xs:attribute name="name" type="xs:string" use="required"/>
        </xs:complexType>
        <xs:unique name="ui名不可重复">
            <xs:selector xpath=".//*"/>
            <xs:field xpath="@name"/>
        </xs:unique>
    </xs:element>
    <xs:complexType name="ui">
        <xs:simpleContent>
            <xs:extension base="xs:string">
                 <xs:attribute name="name" type="xs:string" use="required"/>
            </xs:extension>
        </xs:simpleContent>
</xs:complexType>
</xs:schema>