<?xml version="1.0" encoding="utf-8" ?>

<!--其他页面：天府安逸主页面-->
<page name="mail" xmlns="http://www.w3school.com.cn"
        xmlns:xsi="http://www.w3.org/2001/XMLSchema-instance"
        xsi:schemaLocation="http://www.w3school.com.cn ../xsd/ui.xsd">
    <ui name="我的应用邮件">poot(text="敏邮")</ui>
    <ui name="添加邮箱">poot(text="添加邮箱")</ui>
    <ui name="邮箱账号输入框">poot(resource_id="com.minxing.client:id/account_email")</ui>
    <ui name="登录">poot(resource_id="com.minxing.client:id/init_btn")</ui>
    <ui name="错误提示框">poot(text="用户名或者密码错误。")</ui>
    <ui name="进入收件箱">poot(resource_id="com.minxing.client:id/btn_mx_mail_message_list_menu")</ui>
    <ui name="成功打开第一封邮件">poot(resource_id="com.minxing.client:id/from")[0]</ui>
    <ui name="邮件列表">poot(resource_id="com.minxing.client:id/from")</ui>
    <ui name="打开邮件有更多按钮">poot(resource_id="com.minxing.client:id/address_simple_more")</ui>
    <ui name="回复">poot(text="回复")</ui>
    <ui name="发送">poot(resource_id="com.minxing.client:id/tv_mx_mail_message_compose_send")</ui>
    <ui name="回复全部">poot(text="回复全部")</ui>
    <ui name="转发">poot(text="转发")</ui>
    <ui name="点击邮件内容">poot(resource_id="com.minxing.client:id/message_content")</ui>
    <ui name="删除">poot(text="删除")</ui>
    <ui name="不要删除">poot(text="不要删除")</ui>
    <ui name="隐藏">poot(text="隐藏")</ui>
    <ui name="收件箱返回按钮">poot(resource_id="com.minxing.client:id/btn_mx_mail_message_list_back")</ui>
    <ui name="更多">poot(text="更多",resource_id="com.minxing.client:id/address_simple_more")</ui>
    <ui name="隐藏">poot(resource_id="com.minxing.client:id/mail_address_hide")</ui>
    <ui name="写邮件">poot(text="写邮件")</ui>
    <ui name="主题">poot(resource_id="com.minxing.client:id/subject")</ui>
    <ui name="邮件内容">poot(resource_id="com.minxing.client:id/message_content")</ui>
    <ui name="断言发件人为空发送邮件失败">poot(resource_id="com.minxing.client:id/tv_mx_mail_message_compose_send")</ui>
    <ui name="断言返回主界面">poot(resource_id="com.minxing.client:id/btn_mx_mail_message_list_menu")</ui>
    <ui name="收件人">poot(resource_id="com.minxing.client:id/contact_btn_container")</ui>
    <ui name="附件">poot(resource_id="com.minxing.client:id/mx_mail_ic_attach")</ui>
    <ui name="任一选择框">poot(resource_id="com.minxing.client:id/media_cbx")</ui>
    <ui name="添加照片">poot(text="添加照片")</ui>
    <ui name="选择确定">poot(resource_id="com.minxing.client:id/media_ok")</ui>
    <ui name="返回按钮">poot(resource_id="com.minxing.client:id/btn_mx_mail_message_compose_back")</ui>
    <ui name="删除草稿">poot(text="删除草稿")</ui>
    <ui name="保存草稿">poot(text="保存草稿")</ui>
    <ui name="编辑">poot(text="编辑")</ui>
    <ui name="点击任一选择框">poot(resource_id="com.minxing.client:id/selected_checkbox")</ui>
    <ui name="断言取消删除成功">poot(resource_id="com.minxing.client:id/selected_checkbox")</ui>
    <ui name="取消全选">poot(text="取消全选")</ui>
    <ui name="全选">poot(text="全选")</ui>
    <ui name="断言出现取消全选">poot(text="取消全选")</ui>
    <ui name="断言出现全选">poot(text="全选")</ui>
    <ui name="搜索">poot(text="搜索")</ui>
    <ui name="搜索邮件成功">poot(resource_id="com.minxing.client:id/subject")</ui>
    <ui name="当前没有数据">poot(resource_id="com.minxing.client:id/nodata")</ui>
    <ui name="进入对应邮件箱">poot(resource_id="com.minxing.client:id/tv_mx_message_list_fragment_title")</ui>
    <ui name="菜单栏">poot(resource_id="com.minxing.client:id/btn_mx_mail_message_list_menu")</ui>
    <ui name="已发送">poot(text="已发送")</ui>
    <ui name="草稿箱">poot(text="草稿箱")</ui>
    <ui name="发件箱">poot(text="发件箱")</ui>
    <ui name="已删除">poot(text="已删除")</ui>
    <ui name="垃圾邮件">poot(text="垃圾邮件")</ui>
    <ui name="设置">poot(text="设置")</ui>
    <ui name="删除账号">poot(text="删除账号")</ui>
    <ui name="取消">poot(text="取消")</ui>
    <ui name="确定">poot(text="确定")</ui>
    <ui name="草稿箱主题">poot(resource_id="com.minxing.client:id/subject_container")</ui>
    <ui name="草稿箱收件人">poot(resource_id="com.minxing.client:id/to_address")</ui>
    <ui name="账号">poot(resource_id="com.minxing.client:id/account_name")</ui>
    <ui name="添加邮箱账号">poot(text="添加邮箱账号")</ui>
    <ui name="输入密码">poot(text="输入密码")</ui>













</page>