<?xml version="1.0" encoding="utf-8" ?>

<!--其他页面：通讯录主页面-->
<page name="OA" xmlns="http://www.w3school.com.cn"
        xmlns:xsi="http://www.w3.org/2001/XMLSchema-instance"
        xsi:schemaLocation="http://www.w3school.com.cn ../xsd/ui.xsd">
    <ui name="我的应用OA">poot(text="OA插件应用")</ui>
    <ui name="OA首页">poot(resource_id="title",text="OA")</ui>
    <ui name="OA首页协同按钮">poot(text="协同")</ui>
    <ui name="协同页搜索图标">poot(resource_id="more")</ui>
    <ui name="自由协同">poot(text="自由协同")</ui>
    <ui name="关闭按钮">poot(resource_id="closeBtn")</ui>
    <ui name="放弃新建按钮">poot(text="放弃新建")</ui>
    <ui name="新建协同页">poot(text="新建协同")</ui>
    <ui name="协同搜索输入框">poot(clazz="android.widget.EditText")</ui>
    <ui name="暂无数据">poot(text="暂无数据")</ui>
    <ui name="接收人员+号图标">poot(resource_id="edit_receiver")</ui>
    <ui name="联系人ui_test1">poot(text="ui_test1")</ui>
    <ui name="联系人ui_test2">poot(text="ui_test2")</ui>
    <ui name="联系人ui_test3">poot(text="ui_test3")</ui>
    <ui name="确认按钮">poot(text="确认")</ui>
    <ui name="编辑流程替换选项">poot(text="替换")</ui>
    <ui name="编辑流程删除选项">poot(text="删除")</ui>
    <ui name="编辑流程新增选项">poot(text="新增")</ui>
    <ui name="编辑流程修改节点权限">poot(text="修改节点权限")</ui>
    <ui name="审批按钮">poot(text="审批")</ui>
    <ui name="修改节点权限完成按钮">poot(text="完成")</ui>
    <ui name="编辑流程完成按钮">poot(text="完成")</ui>
    <ui name="标题输入框">poot(resource_id="preDiv")</ui>
    <ui name="接收人输入框">poot(resource_id="receiver_container_text")</ui>
    <ui name="再次点击接收人输入框">poot(clazz="android.widget.EditText")</ui>
    <ui name="接收人ui_test1">poot(text="测试")</ui>
    <ui name="接收人ui_test2">poot(text="测试")</ui>
    <ui name="接收人选项框删除图标"></ui>
    <ui name="协同正文输入框">poot(resource_id="content")</ui>
    <ui name="发送按钮">poot(text="发送")</ui>
    <ui name="协同待办按钮">poot(text="待办")</ui>
    <ui name="搜索的协同">poot(text="test")</ui>
    <ui name="取消按钮">poot(text="取消")</ui>
    <ui name="协同已发按钮">poot(text="已发")</ui>
    <ui name="已发送协同">poot(text="test")</ui>
    <ui name="撤销按钮">poot(resource_id="cancelBtn")</ui>
    <ui name="撤销原因输入框">poot(resource_id="content")</ui>
    <ui name="确定按钮">poot(resource_id="sendBtn")</ui>
    <ui name="撤销确定按钮">poot(text="取消").sibling()[-1]</ui>
    <ui name="协同待发按钮">poot(text="待发")</ui>
    <ui name="批量操作按钮">poot(text="刚刚已为你刷新过")</ui>
    <ui name="全选按钮">poot(text="全选")</ui>
    <ui name="删除按钮">poot(text="删除")</ui>
    <ui name="删除确定按钮">poot(text="确定")</ui>
    <ui name="提示框确定按钮">poot(text="确定")</ui>
    <ui name="返回按钮">poot(resource_id="prev")</ui>
    <ui name="表单模板按钮">poot(text="表单模板")</ui>
    <ui name="全部模板按钮">poot(textM=".*全部模板.*")</ui>
    <ui name="行政审批按钮">poot(text="行政审批")</ui>
    <ui name="OA系统业务申请表">poot(text="oa系统业务申请表")</ui>
    <ui name="问题描述输入框">poot(resource_id="field0007",clazz="android.widget.EditText")</ui>
    <ui name="已发送表单协同">poot(part_text="oa系统业务申请表")</ui>
    <ui name="保存到待发按钮">poot(text="保存到待发")</ui>
    <ui name="协同处理按钮">poot(text="处理")</ui>
    <ui name="协同暂存待办按钮">poot(text="暂存待办")</ui>
    <ui name="暂存待办图标">poot(text="1条回复")</ui>
    <ui name="处理意见输入框">poot(resource_id="content")</ui>
    <ui name="协同提交按钮">poot(resource_id="submitBtn")</ui>
    <ui name="协同已办按钮">poot(text="已办")</ui>
    <ui name="已处理协同">poot(text="test")</ui>
    <ui name="归档按钮">poot(text="归档")</ui>
    <ui name="我的文档按钮">poot(text="我的文档")</ui>
    <ui name="归档确定按钮">poot(text="确定")</ui>
    <ui name="归档路径确定按钮">poot(text="确定")</ui>
    <ui name="提示确定按钮">poot(text="确定")</ui>
    <ui name="归档成功提示">poot(text="已成功归档至 “我的文档” 中!")</ui>
    <ui name="删除成功提示">poot(text="删除成功！")</ui>
    <ui name="转发按钮">poot(text="转发")</ui>
    <ui name="转发输入框">poot(text="接收人:").sibling()[1].child()</ui>
    <ui name="接收人删除图标">poot(text="测试").parent().parent().parent().sibling()[0]</ui>
    <ui name="附言输入框">poot(resource_id="content")</ui>
    <ui name="转发协同发送按钮">poot(resource_id="sendBtn")</ui>
    <ui name="转发的协同">poot(text="test(由ui_test1原发)")</ui>
    <ui name="批处理按钮">poot(text="批处理")</ui>
    <ui name="批处理确定按钮">poot(resource_id="submitBtn")</ui>
    <ui name="已发送第二个协同">poot(text="test2")</ui>
    <ui name="取回按钮">poot(resource_id="takeBackBtn")</ui>
    <ui name="重新处理按钮">poot(text="否，重新处理")</ui>
    <ui name="知道了提示语">poot(text="知道了")</ui>
    <ui name="流程按钮">poot(resource_id="workflowBtn")</ui>
    <ui name="催办按钮">poot(text="唐红霞").sibling()[12]</ui>
    <ui name="催办理由输入框">poot(resource_id="content")</ui>
    <ui name="催办成功提示">poot(text="催办成功！")</ui>
    <ui name="催办成功提示框确定按钮">poot(text="确定")</ui>
    <ui name="流程返回按钮">poot(resource_id="goBackBtn")</ui>
    <ui name="协同详情页返回按钮">poot(textM=".*返回.*")</ui>
    <ui name="编辑按钮">poot(resource_id="editBtn")</ui>
    <ui name="新闻按钮">poot(text="新闻")</ui>
    <ui name="搜索按钮">poot(text="搜索")</ui>
    <ui name="新闻搜索输入框">poot(text="取消").parent().sibling()[1]</ui>
    <ui name="搜索的新闻">poot(resource_id="news_list_title",text="UI自动化测试")</ui>
    <ui name="要查看的新闻">poot(resource_id="news_list_title",text="UI自动化测试")</ui>
    <ui name="新闻正文内容">poot(text="UI自动化测试")</ui>
    <ui name="阅读全文按钮">poot(resource_id="news_list_a")[0]</ui>
    <ui name="评论图标">poot(resource_id="comment").child()[0]</ui>
    <ui name="评论输入框">poot(resource_id="reply_content")</ui>
    <ui name="评论内容">poot(text="test")</ui>
    <ui name="删除图标">poot(text="test").sibling()[3]</ui>
    <ui name="收藏按钮">poot(text="收藏")</ui>
    <ui name="取消收藏按钮">poot(text="取消收藏")</ui>
    <ui name="公文按钮">poot(text="公文")</ui>
    <ui name="搜索图标">poot(resource_id="title").sibling()[1]</ui>
    <ui name="公文搜索输入框">poot(text="取消").parent().sibling()[1]</ui>
    <ui name="搜索的公文">poot(textM=".*test")</ui>
    <ui name="要回退的公文">poot(text=" 测试回退待办公文")</ui>
    <ui name="菜单栏">poot(text="edocSummary")</ui>
    <ui name="回退按钮">poot(textM="回退.*")</ui>
    <ui name="回退原因输入框">poot(resource_id="edoc_deal_content")</ui>
    <ui name="确定图标">poot(text="确定")</ui>
    <ui name="升级按钮">poot(part_text="升级")</ui>
    <ui name="撤销的公文">poot(textM=".*测试撤销待办公文")</ui>
    <ui name="公文处理按钮">poot(resource_id="deal")</ui>
    <ui name="菜单栏按钮">poot(resource_id="deal").sibling()[0]</ui>
    <ui name="公文撤销按钮">poot(text="撤销")</ui>
    <ui name="公文撤销原因输入框">poot(resource_id="edoc_deal_content")</ui>
    <ui name="公文确定按钮">poot(text="确定")</ui>
    <ui name="处理的公文">poot(textM=".*test")</ui>
    <ui name="暂存待办按钮">poot(text="暂存待办")</ui>
    <ui name="暂存图标">poot(text="暂存")</ui>
    <ui name="提交按钮">poot(text="提交")</ui>
    <ui name="发文选项">poot(text="发文")</ui>
    <ui name="已办按钮">poot(text="已办")</ui>
    <ui name="全部待办按钮">poot(resource_id="allPendingTab")</ui>
    <ui name="取回确认按钮">poot(text="取消").sibling()[-1]</ui>
    <ui name="公文取回按钮">poot(resource_id="takeBack")</ui>
    <ui name="要加签的公文">poot(textM=".*测试加签审批人员")</ui>
    <ui name="公文菜单栏">poot(resource_id="goBack").sibling()[1]</ui>
    <ui name="加签按钮">poot(text="加签")</ui>
    <ui name="公文确认按钮">poot(resource_id="submit")</ui>
    <ui name="加签的人员">poot(text="ui_test2")</ui>
    <ui name="完成按钮">poot(text="完成")</ui>
    <ui name="终止的公文">poot(textM=".*测试终止待办公文")</ui>
    <ui name="终止按钮">poot(textM="终止.*")</ui>
    <ui name="终止输入框">poot(resource_id="edoc_deal_content")</ui>
    <ui name="处理的收文">poot(textM=".*测试收文")</ui>
    <ui name="收文按钮">poot(text="收文")</ui>
    <ui name="公告按钮">poot(part_text="公告")</ui>
    <ui name="公告搜索图标">poot(resource_id="search")</ui>
    <ui name="搜索输入框">poot(text="取消").parent().sibling()[1]</ui>
    <ui name="搜索的公告">poot(text="UI自动化测试")</ui>
    <ui name="查看的公告">poot(text="UI自动化测试")</ui>
    <ui name="发起表单">poot(text="发起表单")</ui>
    <ui name="表单搜索图标">poot(resource_id="more")</ui>
    <ui name="搜索框">poot(resource_id="subject")</ui>
    <ui name="搜索的表单">poot(text="工作沟通")</ui>
    <ui name="发送的表单模板">poot(part_text="oa系统业务申请表")</ui>
    <ui name="协同菜单栏">poot(resource_id="switch_pop_btn")</ui>
    <ui name="协同确定按钮">poot(text="确定")</ui>
    <ui name="指定回退按钮">poot(textM="指定回退.*")</ui>
    <ui name="流程重走按钮">poot(text="流程重走")</ui>
    <ui name="移交按钮">poot(textM="移交.*")</ui>
    <ui name="确认">poco("select_okBtn")</ui>
    <ui name="正文">poot(text="正文")</ui>
    <ui name="公文正文内容">poot(text="此为正文内容")</ui>
    <ui name="知会按钮">poot(text="知会")</ui>
    <ui name="知会节点">poot(text="[知会]")</ui>
</page>